{
  "$schema": "../workflow-graph-edge-shard.schema.json",
  "authority": "authoritative-workflow-graph-source-shard",
  "edges": [
    {
      "condition_code": "conditional",
      "condition_source": "email/setup/list-growth-designer/SKILL.md:86",
      "condition_text": "If the signup page / popup needs building: landing-optimizer — the post-click / capture-surface UX.",
      "documentation_required": true,
      "exception": null,
      "from": "list-growth-designer",
      "gate": null,
      "id": "list-growth-designer--landing-optimizer",
      "loop_policy": {
        "max_traversals": 1,
        "mode": "visited-set"
      },
      "permissions": [
        "none"
      ],
      "precondition_codes": [
        "automatic-handoff-cap-available",
        "handoff-unambiguous",
        "required-inputs-present",
        "target-not-visited"
      ],
      "required_inputs": [
        "condition-evidence",
        "cross-discipline-context",
        "handoff-summary"
      ],
      "to": "landing-optimizer",
      "type": "cross-discipline"
    },
    {
      "condition_code": "conditional",
      "condition_source": "email/setup/list-hygiene-monitor/SKILL.md:86",
      "condition_text": "If the point-in-time send signal needs verifying before the next campaign: deliverability-qa — the one-time S1 auth pre-flight (a different job from this ongoing watch).",
      "documentation_required": true,
      "exception": null,
      "from": "list-hygiene-monitor",
      "gate": null,
      "id": "list-hygiene-monitor--deliverability-qa",
      "loop_policy": {
        "max_traversals": 1,
        "mode": "visited-set"
      },
      "permissions": [
        "none"
      ],
      "precondition_codes": [
        "automatic-handoff-cap-available",
        "handoff-unambiguous",
        "required-inputs-present",
        "target-not-visited"
      ],
      "required_inputs": [
        "condition-evidence",
        "handoff-summary"
      ],
      "to": "deliverability-qa",
      "type": "conditional"
    },
    {
      "condition_code": "quality-gate",
      "condition_source": "email/setup/list-hygiene-monitor/SKILL.md:87",
      "condition_text": "If the hygiene reads are ready to roll into a verdict: email-quality-auditor — score the full EQS and enforce S1/S2/N1/D1, including the suppression-leakage N1 candidate this run flagged.",
      "documentation_required": true,
      "exception": null,
      "from": "list-hygiene-monitor",
      "gate": "email-quality-auditor",
      "id": "list-hygiene-monitor--email-quality-auditor",
      "loop_policy": {
        "max_traversals": 1,
        "mode": "visited-set"
      },
      "permissions": [
        "none"
      ],
      "precondition_codes": [
        "automatic-handoff-cap-available",
        "gate-evidence-ready",
        "handoff-unambiguous",
        "required-inputs-present",
        "target-not-visited"
      ],
      "required_inputs": [
        "audit-evidence",
        "handoff-summary"
      ],
      "to": "email-quality-auditor",
      "type": "gate"
    },
    {
      "condition_code": "primary",
      "condition_source": "email/setup/list-hygiene-monitor/SKILL.md:85",
      "condition_text": "Primary: reactivation-specialist — run the win-back / re-permission campaign against the re-permission cohort this worklist sizes (SEND-N lifecycle).",
      "documentation_required": true,
      "exception": null,
      "from": "list-hygiene-monitor",
      "gate": null,
      "id": "list-hygiene-monitor--reactivation-specialist",
      "loop_policy": {
        "max_traversals": 1,
        "mode": "visited-set"
      },
      "permissions": [
        "none"
      ],
      "precondition_codes": [
        "automatic-handoff-cap-available",
        "handoff-unambiguous",
        "required-inputs-present",
        "target-not-visited"
      ],
      "required_inputs": [
        "handoff-summary"
      ],
      "to": "reactivation-specialist",
      "type": "sequential"
    },
    {
      "condition_code": "governance",
      "condition_source": "email/setup/list-segment-builder/SKILL.md:88",
      "condition_text": "If consent records are missing or stale for a cohort: consent-registry — record lawful basis and opt-in facts before that cohort is mailable (registry is the sole writer of memory/consent/).",
      "documentation_required": true,
      "exception": null,
      "from": "list-segment-builder",
      "gate": null,
      "id": "list-segment-builder--consent-registry",
      "loop_policy": {
        "max_traversals": 1,
        "mode": "visited-set"
      },
      "permissions": [
        "persistent-write-approval",
        "owner-capability",
        "safety-capability"
      ],
      "precondition_codes": [
        "automatic-handoff-cap-available",
        "handoff-unambiguous",
        "permission-approved",
        "required-inputs-present",
        "target-not-visited"
      ],
      "required_inputs": [
        "handoff-summary",
        "registry-proposal"
      ],
      "to": "consent-registry",
      "type": "memory"
    },
    {
      "condition_code": "primary",
      "condition_source": "email/setup/list-segment-builder/SKILL.md:87",
      "condition_text": "Primary: email-creative-builder — compose a message-matched unit for the top segment; or email-sequence-designer when the next gap is a lifecycle flow per stage.",
      "documentation_required": true,
      "exception": null,
      "from": "list-segment-builder",
      "gate": null,
      "id": "list-segment-builder--email-creative-builder",
      "loop_policy": {
        "max_traversals": 1,
        "mode": "visited-set"
      },
      "permissions": [
        "none"
      ],
      "precondition_codes": [
        "automatic-handoff-cap-available",
        "handoff-unambiguous",
        "required-inputs-present",
        "target-not-visited"
      ],
      "required_inputs": [
        "handoff-summary"
      ],
      "to": "email-creative-builder",
      "type": "sequential"
    },
    {
      "condition_code": "quality-gate",
      "condition_source": "email/setup/list-segment-builder/SKILL.md:89",
      "condition_text": "Termination: apply the global rule from skill-contract.md §Termination rules — visited-set check (do not re-invoke a skill already run in this chain), max-depth: 3, and stop-and-report when routing is ambiguous (e.g. both creative and sequence are equally the next gap). Segmentation is upstream of the EQS gate: hand off to a compose/flow skill, then stop; do not self-invoke email-quality-auditor — the gate is triggered separately.",
      "documentation_required": true,
      "exception": null,
      "from": "list-segment-builder",
      "gate": "email-quality-auditor",
      "id": "list-segment-builder--email-quality-auditor",
      "loop_policy": {
        "max_traversals": 1,
        "mode": "visited-set"
      },
      "permissions": [
        "none"
      ],
      "precondition_codes": [
        "automatic-handoff-cap-available",
        "gate-evidence-ready",
        "handoff-unambiguous",
        "required-inputs-present",
        "target-not-visited"
      ],
      "required_inputs": [
        "audit-evidence",
        "handoff-summary"
      ],
      "to": "email-quality-auditor",
      "type": "gate"
    },
    {
      "condition_code": "primary",
      "condition_source": "email/setup/list-segment-builder/SKILL.md:87",
      "condition_text": "Primary: email-creative-builder — compose a message-matched unit for the top segment; or email-sequence-designer when the next gap is a lifecycle flow per stage.",
      "documentation_required": true,
      "exception": null,
      "from": "list-segment-builder",
      "gate": null,
      "id": "list-segment-builder--email-sequence-designer",
      "loop_policy": {
        "max_traversals": 1,
        "mode": "visited-set"
      },
      "permissions": [
        "none"
      ],
      "precondition_codes": [
        "automatic-handoff-cap-available",
        "handoff-unambiguous",
        "required-inputs-present",
        "target-not-visited"
      ],
      "required_inputs": [
        "handoff-summary"
      ],
      "to": "email-sequence-designer",
      "type": "sequential"
    },
    {
      "condition_code": "governance",
      "condition_source": "protocol/memory-management/SKILL.md:153",
      "condition_text": "Route a canonical conflict to its owner: entity-registry, creator-registry, offer-claims-registry, consent-registry, launch-registry, channel-registry, or narrative-registry. Resume execution work only after the needed projection and authorization state are clear.",
      "documentation_required": true,
      "exception": null,
      "from": "memory-management",
      "gate": null,
      "id": "memory-management--channel-registry",
      "loop_policy": {
        "max_traversals": 1,
        "mode": "visited-set"
      },
      "permissions": [
        "persistent-write-approval",
        "owner-capability"
      ],
      "precondition_codes": [
        "automatic-handoff-cap-available",
        "handoff-unambiguous",
        "permission-approved",
        "required-inputs-present",
        "target-not-visited"
      ],
      "required_inputs": [
        "handoff-summary",
        "registry-proposal"
      ],
      "to": "channel-registry",
      "type": "memory"
    },
    {
      "condition_code": "governance",
      "condition_source": "protocol/memory-management/SKILL.md:153",
      "condition_text": "Route a canonical conflict to its owner: entity-registry, creator-registry, offer-claims-registry, consent-registry, launch-registry, channel-registry, or narrative-registry. Resume execution work only after the needed projection and authorization state are clear.",
      "documentation_required": true,
      "exception": null,
      "from": "memory-management",
      "gate": null,
      "id": "memory-management--consent-registry",
      "loop_policy": {
        "max_traversals": 1,